Que, opt1, opt2, opt3, opt4, answ
Which of the following is a valid declaration of a variable in Java?,int var,2var,Var,Int,int var
Which method is used to print something to the console in Java?,print(),println(),System.out.print(),System.print(),System.out.print()
Which keyword is used to define a class in Java?,Class,def,class,define,class
What is the size of an int data type in Java?,4 bytes,2 bytes,8 bytes,16 bytes,4 bytes
Which of the following is not a primitive data type in Java?,int,float,String,double,String